{
  "koleda": {
    "enabled": false,
    "rok": "2026",
    "opis": "Serdecznie zapraszamy do przyjęcia wizyty duszpasterskiej. Prosimy o przygotowanie stołu z krzyżem, świecą i wodą święconą.",
    "godziny": "16:00 – 19:00",
    "harmonogram": [
      { "dzien": "Poniedziałek, 5 stycznia", "ulice": "ul. Główna, ul. Polna" },
      { "dzien": "Wtorek, 6 stycznia",       "ulice": "ul. Kościelna, ul. Łódzka" },
      { "dzien": "Środa, 7 stycznia",        "ulice": "ul. Leśna, ul. Ogrodowa" }
    ]
  },
  "koncert": {
    "enabled": false,
    "tytul": "Koncert w kościele",
    "opis": "Serdecznie zapraszamy na koncert kolęd i pastorałek w wykonaniu chóru parafialnego. Wstęp wolny – zapraszamy całe rodziny!",
    "data": "12 stycznia",
    "godzina": "18:00",
    "wstep": "Wolny",
    "zdjecie": "/images/koncert.jpg"
  },
  "ogolne": {
    "enabled": true,
    "wpisy": []
  },
  "intencje": {
    "enabled": true,
    "tydzien": "",
    "wpisy": []
  }
}
